{
  "schema": "pyramid-usage-report-v1",
  "status": "available",
  "error": null,
  "scope": "local-user-all-projects",
  "storage": "/Users/merdankiji/.local/state/pyramid-task/usage.sqlite3",
  "collection_enabled": false,
  "window": {
    "days": 30,
    "from_utc": "2026-09-06"
  },
  "first_recorded": "2026-09-27T12:58:45.856+00:00",
  "last_recorded": "2026-10-05T22:42:08.418+00:00",
  "totals": {
    "invocations": 5693,
    "succeeded": 5607,
    "failed": 84,
    "interrupted": 0,
    "duration_ms": 6784127,
    "stdout_bytes": 495155935,
    "unfinished": 2,
    "average_ms": 1192.08
  },
  "commands": [
    {
      "command": "amend",
      "invocations": 89,
      "succeeded": 71,
      "failed": 18,
      "interrupted": 0,
      "duration_ms": 96903,
      "stdout_bytes": 187520,
      "unfinished": 0,
      "average_ms": 1088.8
    },
    {
      "command": "archive",
      "invocations": 0,
      "succeeded": 0,
      "failed": 0,
      "interrupted": 0,
      "duration_ms": 0,
      "stdout_bytes": 0,
      "unfinished": 0,
      "average_ms": null
    },
    {
      "command": "assess",
      "invocations": 20,
      "succeeded": 18,
      "failed": 2,
      "interrupted": 0,
      "duration_ms": 3893,
      "stdout_bytes": 54763,
      "unfinished": 0,
      "average_ms": 194.65
    },
    {
      "command": "audit",
      "invocations": 207,
      "succeeded": 199,
      "failed": 8,
      "interrupted": 0,
      "duration_ms": 223726,
      "stdout_bytes": 6704924,
      "unfinished": 0,
      "average_ms": 1080.8
    },
    {
      "command": "clean",
      "invocations": 0,
      "succeeded": 0,
      "failed": 0,
      "interrupted": 0,
      "duration_ms": 0,
      "stdout_bytes": 0,
      "unfinished": 0,
      "average_ms": null
    },
    {
      "command": "close",
      "invocations": 6,
      "succeeded": 6,
      "failed": 0,
      "interrupted": 0,
      "duration_ms": 8160,
      "stdout_bytes": 11857,
      "unfinished": 0,
      "average_ms": 1360.0
    },
    {
      "command": "compile",
      "invocations": 0,
      "succeeded": 0,
      "failed": 0,
      "interrupted": 0,
      "duration_ms": 0,
      "stdout_bytes": 0,
      "unfinished": 0,
      "average_ms": null
    },
    {
      "command": "create",
      "invocations": 3,
      "succeeded": 3,
      "failed": 0,
      "interrupted": 0,
      "duration_ms": 1175,
      "stdout_bytes": 3560,
      "unfinished": 0,
      "average_ms": 391.67
    },
    {
      "command": "diff",
      "invocations": 17,
      "succeeded": 17,
      "failed": 0,
      "interrupted": 0,
      "duration_ms": 18429,
      "stdout_bytes": 157582,
      "unfinished": 0,
      "average_ms": 1084.06
    },
    {
      "command": "doctor",
      "invocations": 28,
      "succeeded": 26,
      "failed": 2,
      "interrupted": 0,
      "duration_ms": 20750,
      "stdout_bytes": 291142,
      "unfinished": 0,
      "average_ms": 741.07
    },
    {
      "command": "expand",
      "invocations": 0,
      "succeeded": 0,
      "failed": 0,
      "interrupted": 0,
      "duration_ms": 0,
      "stdout_bytes": 0,
      "unfinished": 0,
      "average_ms": null
    },
    {
      "command": "history",
      "invocations": 9,
      "succeeded": 5,
      "failed": 4,
      "interrupted": 0,
      "duration_ms": 5064,
      "stdout_bytes": 85697,
      "unfinished": 0,
      "average_ms": 562.67
    },
    {
      "command": "impact",
      "invocations": 335,
      "succeeded": 321,
      "failed": 14,
      "interrupted": 0,
      "duration_ms": 377729,
      "stdout_bytes": 5233189,
      "unfinished": 0,
      "average_ms": 1127.55
    },
    {
      "command": "inspect",
      "invocations": 3381,
      "succeeded": 3380,
      "failed": 0,
      "interrupted": 0,
      "duration_ms": 2486414,
      "stdout_bytes": 311370545,
      "unfinished": 1,
      "average_ms": 735.63
    },
    {
      "command": "lifecycle",
      "invocations": 72,
      "succeeded": 72,
      "failed": 0,
      "interrupted": 0,
      "duration_ms": 86911,
      "stdout_bytes": 12803407,
      "unfinished": 0,
      "average_ms": 1207.1
    },
    {
      "command": "new-intent",
      "invocations": 42,
      "succeeded": 37,
      "failed": 5,
      "interrupted": 0,
      "duration_ms": 33567,
      "stdout_bytes": 64632,
      "unfinished": 0,
      "average_ms": 799.21
    },
    {
      "command": "pause",
      "invocations": 35,
      "succeeded": 30,
      "failed": 5,
      "interrupted": 0,
      "duration_ms": 294391,
      "stdout_bytes": 8760916,
      "unfinished": 0,
      "average_ms": 8411.17
    },
    {
      "command": "reopen",
      "invocations": 21,
      "succeeded": 21,
      "failed": 0,
      "interrupted": 0,
      "duration_ms": 47544,
      "stdout_bytes": 1713826,
      "unfinished": 0,
      "average_ms": 2264.0
    },
    {
      "command": "replan",
      "invocations": 181,
      "succeeded": 179,
      "failed": 2,
      "interrupted": 0,
      "duration_ms": 271752,
      "stdout_bytes": 321902,
      "unfinished": 0,
      "average_ms": 1501.39
    },
    {
      "command": "reset",
      "invocations": 0,
      "succeeded": 0,
      "failed": 0,
      "interrupted": 0,
      "duration_ms": 0,
      "stdout_bytes": 0,
      "unfinished": 0,
      "average_ms": null
    },
    {
      "command": "restore",
      "invocations": 0,
      "succeeded": 0,
      "failed": 0,
      "interrupted": 0,
      "duration_ms": 0,
      "stdout_bytes": 0,
      "unfinished": 0,
      "average_ms": null
    },
    {
      "command": "resume",
      "invocations": 62,
      "succeeded": 61,
      "failed": 1,
      "interrupted": 0,
      "duration_ms": 310896,
      "stdout_bytes": 13698865,
      "unfinished": 0,
      "average_ms": 5014.45
    },
    {
      "command": "take",
      "invocations": 226,
      "succeeded": 221,
      "failed": 4,
      "interrupted": 0,
      "duration_ms": 554425,
      "stdout_bytes": 15070561,
      "unfinished": 1,
      "average_ms": 2464.11
    },
    {
      "command": "update",
      "invocations": 308,
      "succeeded": 289,
      "failed": 19,
      "interrupted": 0,
      "duration_ms": 1477529,
      "stdout_bytes": 118406738,
      "unfinished": 0,
      "average_ms": 4797.17
    },
    {
      "command": "validate",
      "invocations": 651,
      "succeeded": 651,
      "failed": 0,
      "interrupted": 0,
      "duration_ms": 464869,
      "stdout_bytes": 214309,
      "unfinished": 0,
      "average_ms": 714.08
    },
    {
      "command": "visualize",
      "invocations": 0,
      "succeeded": 0,
      "failed": 0,
      "interrupted": 0,
      "duration_ms": 0,
      "stdout_bytes": 0,
      "unfinished": 0,
      "average_ms": null
    }
  ],
  "unmeasured_skills": [
    "orchestrate",
    "simplify"
  ],
  "limitations": [
    "Counts CLI calls, not skill invocations or internal Python API calls; no historical backfill.",
    "Help, argument-parser rejections, inspect --usage, disabled and failed collection are excluded.",
    "Unfinished means still running, killed, or completion recording failed; it is not a failure verdict.",
    "Machine-local, best-effort coverage only; the query does not test storage write permission.",
    "Duration is CLI wall time (including live-server lifetime), not agent work or model latency.",
    "Stdout bytes are not tokens or proof of useful work; low usage alone does not prove redundancy."
  ],
  "breakdown": [
    {
      "command": "amend",
      "mode": "apply",
      "format": "compact",
      "version": "4.0.0",
      "invocations": 29,
      "succeeded": 29,
      "failed": 0,
      "interrupted": 0,
      "duration_ms": 61121,
      "stdout_bytes": 107158,
      "unfinished": 0,
      "average_ms": 2107.62
    },
    {
      "command": "amend",
      "mode": "apply",
      "format": "compact",
      "version": "4.1.0",
      "invocations": 6,
      "succeeded": 6,
      "failed": 0,
      "interrupted": 0,
      "duration_ms": 4061,
      "stdout_bytes": 27387,
      "unfinished": 0,
      "average_ms": 676.83
    },
    {
      "command": "amend",
      "mode": "preview",
      "format": "compact",
      "version": "4.0.0",
      "invocations": 46,
      "succeeded": 30,
      "failed": 16,
      "interrupted": 0,
      "duration_ms": 29548,
      "stdout_bytes": 42848,
      "unfinished": 0,
      "average_ms": 642.35
    },
    {
      "command": "amend",
      "mode": "preview",
      "format": "compact",
      "version": "4.1.0",
      "invocations": 8,
      "succeeded": 6,
      "failed": 2,
      "interrupted": 0,
      "duration_ms": 2173,
      "stdout_bytes": 10127,
      "unfinished": 0,
      "average_ms": 271.62
    },
    {
      "command": "assess",
      "mode": "apply",
      "format": "compact",
      "version": "4.0.0",
      "invocations": 5,
      "succeeded": 5,
      "failed": 0,
      "interrupted": 0,
      "duration_ms": 2440,
      "stdout_bytes": 19832,
      "unfinished": 0,
      "average_ms": 488.0
    },
    {
      "command": "assess",
      "mode": "apply",
      "format": "compact",
      "version": "4.1.0",
      "invocations": 3,
      "succeeded": 3,
      "failed": 0,
      "interrupted": 0,
      "duration_ms": 709,
      "stdout_bytes": 8941,
      "unfinished": 0,
      "average_ms": 236.33
    },
    {
      "command": "assess",
      "mode": "preview",
      "format": "compact",
      "version": "4.0.0",
      "invocations": 8,
      "succeeded": 7,
      "failed": 1,
      "interrupted": 0,
      "duration_ms": 605,
      "stdout_bytes": 20277,
      "unfinished": 0,
      "average_ms": 75.62
    },
    {
      "command": "assess",
      "mode": "preview",
      "format": "compact",
      "version": "4.1.0",
      "invocations": 4,
      "succeeded": 3,
      "failed": 1,
      "interrupted": 0,
      "duration_ms": 139,
      "stdout_bytes": 5713,
      "unfinished": 0,
      "average_ms": 34.75